{
  "packet_type": "discovery-judgment-packet",
  "recorded_at": "2026-06-18T04:10:06.824Z",
  "judgment_id": "DJP-MQIZEJC8-LRR4W9",
  "council_id": "discovery-council",
  "judgment_status": "synthesize-handoff",
  "decision_summary": "The proposal addresses a real operator gap, but the releasable version should be narrower than the full Mission Control vision.",
  "rationale": "Current visibility surfaces expose status, timeline, and flow separately. The next truthful step is to compose mission summary, artifact lineage, blockers, and recommended next action from canonical runtime artifacts.",
  "desirability_assessment": "High. Operators need a faster way to understand what is happening, why it happened, and what should happen next.",
  "feasibility_assessment": "Good if the release is limited to derived summaries and graph views based on existing artifacts, not live orchestration claims.",
  "risk_assessment": "The main risks are duplicate truth surfaces, ornamental UI scope creep, and overstating liveness beyond current runtime data freshness.",
  "evidence_quality_state": "sufficient",
  "recommended_next_step": "Create a bounded discovery-to-delivery handoff for a Mission Control visibility layer release candidate.",
  "question_set_refs": [
    ".aof/artifacts/discovery/question-sets/DQS-MQIZCECJ-TU6MBI.json"
  ],
  "artifact_refs": [
    ".aof/artifacts/discovery/assumption-maps/ASM-MQIZCECJ-QE2IVF.json",
    ".aof/artifacts/discovery/anomaly-logs/ANL-MQIZCECJ-0WB7D6.json"
  ],
  "follow_up_questions": [
    "Which Mission Control views are mandatory for the first truthful release slice?"
  ],
  "promotion_ready": true,
  "handoff_required": true,
  "source_task_id": "TASK-041",
  "source_decision_record_id": null
}
